{
  "$schema": "https://json-schema.org/draft/2020-12/schema",
  "$id": "https://github.com/Wdclouds/FEAGLEwxbot/packages/protocol/schemas/android-bridge-v1.schema.json",
  "title": "FEAGLE Android Agent to Bridge protocol v1",
  "type": "object",
  "required": ["protocol", "type"],
  "properties": {
    "protocol": { "const": "feagle.android.v1" },
    "type": {
      "enum": [
        "pair_request", "pair_ack", "pair_rejected",
        "hello", "hello_ack", "heartbeat", "pong", "hook_status",
        "private_text", "group_text", "event_ack", "event_nack",
        "send_text", "command_result",
        "refresh_contacts", "contacts_snapshot"
      ]
    },
    "deviceId": { "type": "string", "minLength": 1, "maxLength": 128 },
    "eventId": { "type": "string", "minLength": 1, "maxLength": 256 },
    "commandId": { "type": "string", "minLength": 1, "maxLength": 256 },
    "talker": { "type": "string", "minLength": 1, "maxLength": 256 },
    "sender": { "type": "string", "minLength": 1, "maxLength": 256 },
    "displayName": { "type": "string", "maxLength": 256 },
    "content": { "type": "string", "minLength": 1, "maxLength": 2000 },
    "chatType": { "enum": ["private", "group"] },
    "mentioned": { "type": "boolean" },
    "createTime": { "type": "integer", "minimum": 0 },
    "msgId": { "type": "integer", "minimum": 0 },
    "msgSvrId": { "type": "integer", "minimum": 0 },
    "timestamp": { "type": "integer", "minimum": 0 },
    "connected": { "type": "boolean" },
    "hookConnected": { "type": "boolean" },
    "wechatVersion": { "type": "string" },
    "accepted": { "type": "boolean" },
    "ok": { "type": "boolean" },
    "error": { "type": "string" },
    "reason": { "type": "string" },
    "retryAfterMs": { "type": "integer", "minimum": 0 },
    "heartbeatTimeoutMs": { "type": "integer", "minimum": 1 },
    "pairingCode": { "type": "string", "pattern": "^[0-9]{8}$" },
    "token": { "type": "string", "minLength": 24 },
    "includeAvatars": { "type": "boolean" },
    "generatedAt": { "type": "string" },
    "full": { "type": "boolean" },
    "name": { "type": "string", "maxLength": 80 },
    "avatarBase64": { "type": "string" },
    "memberCount": { "type": "integer", "minimum": 0 },
    "groups": {
      "type": "array",
      "items": {
        "type": "object",
        "required": ["talker", "name", "avatarBase64", "memberCount"],
        "properties": {
          "talker": { "type": "string", "minLength": 1, "maxLength": 256 },
          "name": { "type": "string", "maxLength": 80 },
          "avatarBase64": { "type": "string" },
          "memberCount": { "type": "integer", "minimum": 0 }
        }
      }
    },
    "privates": {
      "type": "array",
      "items": {
        "type": "object",
        "required": ["talker", "name", "avatarBase64"],
        "properties": {
          "talker": { "type": "string", "minLength": 1, "maxLength": 256 },
          "name": { "type": "string", "maxLength": 80 },
          "avatarBase64": { "type": "string" }
        }
      }
    },
    "privateContacts": {
      "type": "array",
      "items": {
        "type": "object",
        "required": ["talker", "name", "avatarBase64"],
        "properties": {
          "talker": { "type": "string", "minLength": 1, "maxLength": 256 },
          "name": { "type": "string", "maxLength": 80 },
          "avatarBase64": { "type": "string" }
        }
      }
    }
  },
  "allOf": [
    {
      "if": { "properties": { "type": { "const": "private_text" } } },
      "then": { "required": ["deviceId", "eventId", "talker", "content"] }
    },
    {
      "if": { "properties": { "type": { "const": "group_text" } } },
      "then": { "required": ["deviceId", "eventId", "talker", "sender", "content", "mentioned"] }
    },
    {
      "if": { "properties": { "type": { "const": "send_text" } } },
      "then": { "required": ["commandId", "chatType", "talker", "content"] }
    },
    {
      "if": { "properties": { "type": { "const": "event_ack" } } },
      "then": { "required": ["eventId"] }
    },
    {
      "if": { "properties": { "type": { "const": "event_nack" } } },
      "then": { "required": ["eventId", "retryAfterMs", "reason"] }
    },
    {
      "if": { "properties": { "type": { "const": "command_result" } } },
      "then": { "required": ["deviceId", "commandId", "ok"] }
    },
    {
      "if": { "properties": { "type": { "const": "refresh_contacts" } } },
      "then": { "required": ["commandId"] }
    },
    {
      "if": { "properties": { "type": { "const": "contacts_snapshot" } } },
      "then": { "required": ["commandId", "generatedAt", "groups", "privateContacts"] }
    }
  ],
  "additionalProperties": true
}
